{
  "schema_version": "1.3",
  "event_id": "11111111-1111-4111-8111-111111111111",
  "claimed_organization_id": "org_alpha",
  "connection_id": "conn_files",
  "source_scope_id": "scope_projects",
  "scope_revision": 3,
  "connector_job_id": "job_sync_scope_projects_0001",
  "operation": "UPSERT",
  "delete_semantics": null,
  "external_object_id": "file-0001",
  "external_version_key": "hash:sha256:0db852eaf182494bb39dd092ab7908e6499fef8baefae9277c0f53c12db483e2",
  "object_type": "FILE",
  "object_metadata": {
    "kind": "FILE",
    "title": "\u041f\u043b\u0430\u043d \u0437\u0430\u043f\u0443\u0441\u043a\u0430.txt",
    "mime_type": "text/plain",
    "source_updated_at": "2026-07-14T11:58:00Z",
    "size_bytes": 157,
    "relative_path": "alpha/\u041f\u043b\u0430\u043d \u0437\u0430\u043f\u0443\u0441\u043a\u0430.txt",
    "canonical_locator_hash": "sha256:06236f2f4f42060c226fd86f533e6c70db3f4844c7d4b766c5d8caa9964d4e62"
  },
  "content_reference": {
    "reference_id": "cr_0123456789abcdef",
    "expires_at": "2026-07-14T12:10:00Z",
    "content_hash": "sha256:0db852eaf182494bb39dd092ab7908e6499fef8baefae9277c0f53c12db483e2",
    "size_bytes": 157,
    "media_type": "text/plain"
  },
  "acl_snapshot": {
    "status": "RESOLVED",
    "principal_tokens": [
      {
        "namespace": "source:conn_files",
        "type": "GROUP",
        "subject": "grp-alpha",
        "revision": "rev-0001"
      }
    ],
    "resolved_at": "2026-07-14T11:59:00Z",
    "expires_at": "2026-07-14T12:14:00Z",
    "content_hash": "sha256:1ae2a6630e185b3f80c0cd502ee842ef0dcfc6253a58da11e8714de68d0bda99"
  },
  "event_time": "2026-07-14T11:59:00Z",
  "observed_at": "2026-07-14T12:00:00Z",
  "idempotency_key": "connector-file-0001-v1",
  "integrity": {
    "algorithm": "ED25519",
    "key_id": "contract-test-ed25519-01",
    "signed_at": "2026-07-14T12:00:00Z",
    "nonce": "AQIDBAUGBwgJCgsMDQ4PEA",
    "payload_hash": "sha256:8ee47f383b6e8bf9b0557f13448767e033b62f05f1cb42f5a7c3b996b8f63243",
    "value_base64": "KmuqfOwoOqUt2wS/FhCM4AGM4TNlPrMvocfaWdHmEceIiuQN4EHWi8IgAjjfa6Hp9K4DJSVmfOuqrJk+9M+fCQ=="
  }
}
